;Level;Stance;Claim;Votes
368;1.0;con;"Most relevant definitions of ""subjective"" state that something is subjective if different people can hold different opinions on the matter. If people can hold different opinions on whether or not abortion is immoral or unethical, it is subjective according to those definitions.";['1', '0', '1', '1', '1']
369;1.0;con;"Morality by definition is not subjective. Preferences are entirely subjective and are neither right or wrong, they are just different tastes. Morality assumes ""right"" is not ""wrong"" and vice versa. Whenever a person assumes something is right they are assuming it is not wrong thus automatically proving a standard.";['1', '0', '2', '0', '1']
370;1.0;con;A fetus develops during the gestational period such that it does gain self-awareness and consciousness. Therefore it can still be argued it should qualify for personhood status while still in utero.;['1', '2', '2', '0', '1']
371;1.0;pro;A fetus develops the capacity for self-awareness and consciousness around the beginning of the second trimester. Thus, it should be regarded as having the unalienable right to life.;['0', '1', '1', '0', '2']
372;1.0;con;While it is true that a fetus develops sentience in utero, it does not have sentience from the moment of conception. Therefore, a fetus should not be considered a person prior to the development of sentience which roughly coincides with the beginning of the 2nd trimester.;['0', '0', '1', '0', '0']
373;1.0;pro;The fetal stage of human development is about 8-40 weeks from conception. Cortical function is present by 30 weeks.;['0', '1', '2', '0', '1']
374;1.0;con;Many non-human animals have cognitive capacities well beyond those of a fetus. These capacities are not typically taken to be sufficient for a right to life in the case of animals so it is unclear why they ought to be sufficient in the case of fetuses.;['1', '1', '1', '0', '2']
375;1.0;con;It's very clear why cognitive capacities are sufficient for a fetus and not sufficient for an animal. A fetus is a human and an animal is not. Human rights are not the same as animal rights.;['1', '1', '1', '0', '1']
376;1.0;pro;"For example, ""right to life"" does not exist among animal rights. One can euthanize their dog.";['0', '0', '1', '0', '0']
377;1.0;con;The referenced material is very far from being the unanimous definition of personhood.;['1', '3', '1', '0', '1']
378;1.0;pro;Personhood is a variable concept depending on one's personal philosophy, and so should not be used as a benchmark for assigning value to human life.;['0', '1', '1', '1', '1']
379;1.0;con;Not being self aware, conscious, and able to feel pain does not stop one from being a person with rights.;['0', '0', '1', '0', '0']
380;1.0;pro;People in a coma or people in an alive but unconscious state aren't disqualified as human or having less rights simply because they are not aware.;['0', '0', '1', '0', '0']
381;1.0;pro;The claim that consciousness is necessary for rights confuses the source of rights with the effect of that source. The root of rights is human nature.;['1', '0', '1', '1', '0']
382;1.0;pro;Consciousness is an effect not a cause of human nature. Nor is evidence of consciousness the only evidence of human nature.;['0', '0', '1', '0', '0']
383;1.0;pro;It is definitely wrong to end the life of a person in a coma if the coma is reversible, and the person probably has a long life ahead of them.;['0', '0', '1', '0', '0']
384;1.0;con;It is always considered wrong to end the life of a healthy human being. It is not always considered wrong to end the life of someone who is in a coma.;['1', '1', '1', '1', '2']
385;1.0;pro;In many cases, the assisted death of someone is performed with the intent of ending suffering (often of patients with a terminal illness).;['1', '0', '2', '0', '0']
386;1.0;con;This is not relevant to fetal personhood because the baby is not suffering, and therefore the justification for taking a life in that case doesn't apply here.;['0', '0', '1', '0', '0']
387;1.0;pro;People who can't feel pain qualify as people.;['0', '0', '1', '0', '0']
388;1.0;pro;"A human being requires a functional brain, wherein the mind resides. During pregnancy the brain doesn't even start to form until six weeks after conception when the neural tube closes, and the brain does not become functional until ""around the time a full-term baby is born"".";['1', '1', '1', '1', '3']
389;1.0;pro;This is why brain death is generally the medical definition of death.;['0', '0', '1', '0', '0']
390;1.0;con;Being a human being does not require a functional brain because anencephalic infants do not have a functional brain, but they are still human beings.;['0', '0', '1', '0', '0']
391;1.0;con;While fetuses may not be considered people, the law has still given them rights in certain situations.;['0', '3', '0', '0', '1']
392;1.0;pro;The Unborn Victims of Violence Act recognises fetuses as legal victims if they are injured or killed as the result of a federal crime of violence.;['0', '0', '3', '1', '1']
393;1.0;pro;Some states in the US have held women criminally liable for using illegal drugs that harm the fetus, therefore recognising that the fetus does have some right to not be harmed.;['1', '1', '2', '0', '1']
394;1.0;pro;Fetal protection policies were used to bar women from working in roles that could cause harm to embryos or fetuses.;['1', '0', '2', '1', '1']
395;1.0;con;The US Supreme Court determined that such policies were a form of sexual discrimination which violated the Civil Rights Act.;['0', '0', '1', '0', '1']
396;1.0;con;Laws can and do change and thus cannot stand as evidence for or against what should be the case.;['0', '0', '1', '0', '0']
397;1.0;con;There is no generally accepted definition of 'personhood', but this argument hinges on one particular definition.;['1', '2', '1', '2', '4']
398;1.0;con;All arguments for or against abortion are dependent upon a specific definition of personhood. At its roots, it is personhood itself that is being debated. Thus it is not valid to dispute one argument but not another on this basis.;['0', '0', '1', '0', '0']
399;1.0;con;"The definitions of ""personhood"" in which the fetus is a person in a philosophically meaningful sense are philosophically inferior to those in which a fetus is not a person.";['0', '0', '1', '0', '0']
400;1.0;pro;If a fetus is defined as a person, it may follow that other biological entities are persons, including bacteria, plants or some animals. As those don't meet the intuitive or conventional notion of persons, such a definition is inferior to one that meets the intuitive notion.;['0', '0', '1', '0', '0']
401;1.0;con;There is plenty of evidence that a human fetus is of human origin. Lacking is the evidence that it's a person.;['0', '0', '1', '0', '0']
402;1.0;pro;Roe v Wade determined that, in the US, a fetus is not legally recognised as a person.;['0', '0', '0', '1', '0']
403;1.0;pro;The right to life is fundamental, but life begins at independent viability.;['1', '1', '1', '1', '1']
404;1.0;pro;A fetus's right to life does not imply the right to use the mother's body to sustain its life.;['1', '1', '0', '2', '2']
405;1.0;pro;In Judith Jarvis Thomson's famous violinist example, she argues that people would be outraged if upon waking up they found themselves plugged to an ailing violinist and told that in order for the violinist to remain alive, they must remain plugged to them for the next nine months.;['2', '1', '1', '1', '4']
406;1.0;pro;Such an experiment demonstrates how abortion does not violate a fetus' right to life. Rather, it just deprives the fetus of the use of the pregnant person's body.;['0', '0', '1', '0', '0']
407;1.0;con;The violinist example can only be used to justify abortion in the case of rape, because in the example, you did nothing that could have led to you being attached to the violinist.;['0', '0', '1', '0', '0']
408;1.0;con;In the violinist example the violinist is a complete stranger, while in a pregnancy the baby is the mother's own child.;['1', '1', '0', '0', '0']
409;1.0;pro;A mother who fails to provide for her own child's basic needs such as food and water is guilty of child neglect, whereas someone who passes a stranger on the street begging for food and doesn't give them anything is not guilty of a crime. This intuitively supports the idea that a person's obligations towards their own child is greater than that towards a stranger.;['0', '0', '0', '1', '0']
410;1.0;con;One plausibly has duties (moral or legal) to persons under one's charge, like children. However, it is not at all clear that one has duties to an unwanted fetus.;['0', '0', '1', '1', '0']
411;1.0;con;"A mother has duties to her two-year-old son, regardless of whether the child is ""wanted"". Therefore it is plausible that the fetus being ""unwanted"" doesn't take away her duties towards it.";['0', '0', '0', '2', '0']
412;1.0;con;The violinist example is not analogous because withdrawing support is very different from directly killing. In that example, the person did not create the violinist's dependency on their body whereas the parents are responsible for the creation of a fetus, thereby creating an obligation to provide due care.;['1', '1', '1', '1', '3']
413;1.0;con;It is an assumption that all biological parents choose to create life, which confers obligations. Many pregnancies are accidental, and even if they weren't, you should be allowed to change your mind after experiencing the realities of pregnancy.;['1', '0', '2', '0', '0']
414;1.0;con;This assumes that withdrawing support is different from direct killing. This distinction is unclear at best, since both cases involve a decision (terminate life) causally connected to a consequence (termination of life).;['1', '0', '2', '1', '0']
415;1.0;pro;When a fetus is able to exist independently from the mother's body they can be considered to be independent living beings. During pregnancy the fetus is specifically reliant on the mother to maintain their life, which is no longer the case once they are born, making them more independent.;['0', '0', '1', '1', '0']
416;1.0;con;The mother's body naturally sends nutrients to the fetus. That she might not consciously approve of this doesn't mean the fetus is violating her rights by accepting the nutrients offered.;['0', '0', '1', '0', '0']
417;1.0;con;Viability is a weak argument for determining the right to life. A human on life-support isn't viable, but we still believe they are are human beings with rights.;['2', '1', '1', '2', '3']
418;1.0;pro;Newborns (and most people who are under 18) cannot live independently, but they are still persons.;['0', '0', '1', '0', '0']
419;1.0;con;This obscures the order in which personhood is first attained. A human on life-support attains viability before losing it in this example.;['1', '1', '1', '1', '1']
420;1.0;con;Independent viability is a moveable target, so irrelevant to the ethics of life and value. No one is 'viable' in an environment contrary to the needs of survival, such as a child in the ocean or an adult in the vacuum of space.;['0', '1', '2', '0', '2']
421;1.0;pro;"Future technology may be able to develop an artificial womb or incubation method as an alternative to pregnancy. This means what is ""viable"" is partially dependent upon current technology and doesn't ultimately answer the question.";['0', '1', '2', '0', '0']
422;1.0;pro;Numerous attempts have been made to pass personhood laws in the US, which would classify zygotes, embryos and fetuses as persons, but such attempts have had little success.;['1', '1', '1', '0', '1']
423;1.0;pro;This continuity begins with sperm and egg, which would make masturbation similar to abortion.;['0', '1', '0', '0', '0']
424;1.0;con;There is no scientific basis to give personhood to the gametes of any of the two sexes. Neither of them is a totipotent cell, with the potentiality to become human beings on their own.;['0', '0', '1', '0', '0']
425;1.0;con;A sperm plus an egg would give rise to such a totipotent cell. If such a cell is of moral value, it stands to reason that what gives rise to it is also of moral value. In that case, destroying or preventing the development of a sperm plus egg would be as immoral as destroying or preventing the development of a zygote or fetus.;['0', '0', '1', '0', '0']
426;1.0;con;Masturbation generally does not include both eggs and sperms present simultaneously, and by most definitions does not include fertilization. There is a distinct beginning of continuity with fertilization.;['0', '0', '2', '0', '0']
427;1.0;pro;There is a big jump between sperm cells and a baby with formed organs inside a mothers womb not yet able to live on its own.;['0', '0', '1', '0', '0']
428;1.0;con;That they have had little success doesn't mean that they are wrong.;['0', '2', '0', '0', '2']
429;1.0;con;The law does not necessarily always reflect what should be the case. Morally, one can still argue that a fetus should be recognised as a person.;['1', '0', '2', '2', '8']
430;1.0;pro;In 1857, the U.S. Supreme Court declared in Dred Scott v. Sandford that blacks were 'not persons' and therefore didn't have the rights of people.;['1', '1', '1', '0', '0']
431;1.0;pro;If laws were always moral, there wouldn't be any reason to ask for a change in the law.;['1', '1', '1', '0', '3']
432;1.0;con;Morals are a set of rules that individuals live by, thus it cannot be suggested that people with different morals are somehow incorrect or wrong. Women should have the right to choose what happens to their body and to live by the morals they choose for themselves.;['0', '0', '1', '0', '0']
433;1.0;con;If a society polices for murder, theft, or other crimes considered immoral, then that society finds it ethically acceptable to determine what is a crime, create laws to prohibit that crime, and then police to enforce the law.;['0', '1', '2', '0', '1']
434;1.0;pro;These laws may change over time as the society reevaluates and changes, but the fundamental ethics of the society hold that it may create laws based in moral principles and then enforce them.;['0', '0', '1', '0', '0']
435;1.0;con;Saying that “women should always have the right to choose” is a moral judgment, that according to your argument, can not be judged as “correct” or “right.” All laws are codifications of moral judgments, and there are some acts that are universally considered immoral, such as the taking of an innocent human life.;['1', '1', '1', '0', '1']
436;1.0;con;A number of scientific advancements mean that the Roe v Wade decision should be reconsidered.;['0', '1', '0', '1', '1']
437;1.0;pro;Since Roe v Wade, significant advancements have been made in genomics allowing us to see that babies in the womb are genetically humans, beginning at conception.;['0', '2', '0', '0', '1']
438;1.0;pro;"In US federal law, the concept of legal personhood is formalized by statute (1 USC §8) to include ""every infant member of the species homo sapiens who is born alive at any stage of development.""";['0', '0', '0', '1', '0']
439;1.0;con;The law does not necessarily always reflect what should be the case. Morally, one can still argue that a fetus should be recognised as a person.;['0', '0', '1', '0', '0']
440;1.0;pro;If laws were always moral, there wouldn't be any reason to ask for a change in the law.;['1', '1', '1', '0', '3']
441;1.0;pro;In 1857, the U.S. Supreme Court declared in Dred Scott v. Sandford that blacks were 'not persons' and therefore didn't have the rights of people.;['1', '1', '1', '0', '0']
442;1.0;con;Morals are a set of rules that individuals live by, thus it cannot be suggested that people with different morals are somehow incorrect or wrong. Women should have the right to choose what happens to their body and to live by the morals they choose for themselves.;['0', '0', '1', '0', '0']
443;1.0;con;If a society polices for murder, theft, or other crimes considered immoral, then that society finds it ethically acceptable to determine what is a crime, create laws to prohibit that crime, and then police to enforce the law.;['0', '1', '2', '0', '1']
444;1.0;pro;These laws may change over time as the society reevaluates and changes, but the fundamental ethics of the society hold that it may create laws based in moral principles and then enforce them.;['0', '0', '1', '0', '0']
445;1.0;con;Saying that “women should always have the right to choose” is a moral judgment, that according to your argument, can not be judged as “correct” or “right.” All laws are codifications of moral judgments, and there are some acts that are universally considered immoral, such as the taking of an innocent human life.;['1', '1', '1', '0', '1']
446;1.0;con;Skin cells are as human as a zygote, gall bladders are as human as a fetus. In neither case is it immoral to destroy the former, thus simply being human is an insufficient criterion.;['1', '0', '1', '0', '3']
447;1.0;pro;Skin cells and gall bladders could develop into a full human (via cloning or transformation into induced pluripotent stem cells), just as a fetus could.;['0', '0', '1', '0', '0']
448;1.0;pro;A fetus is human in that it has human DNA: skin cells and gall bladders have human DNA.;['0', '0', '1', '0', '0']
449;1.0;con;A gall bladder is part of a human, and so are skin cells. However, a zygote is a whole human, which makes it immoral to destroy.;['0', '0', '1', '0', '0']
450;1.0;con;Fetuses are not whole humans. If they were, they would be able to live outside the womb without the mother's help. The earlier in the development of a fetus, the less whole it is.;['0', '0', '1', '0', '0']
451;1.0;con;Viability is a weak argument for determining the right to life. A human on life-support isn't viable, but we still believe they are are human beings with rights.;['0', '0', '1', '0', '0']
452;1.0;pro;Newborns (and most people who are under 18) cannot live independently, but they are still persons.;['0', '0', '1', '0', '0']
453;1.0;con;This obscures the order in which personhood is first attained. A human on life-support attains viability before losing it in this example.;['1', '1', '1', '1', '1']
454;1.0;con;It is, in fact, immoral to destroy someone else's gall bladder without their permission.;['0', '0', '1', '0', '0']
455;1.0;pro;The right to life should be considered fundamental and absolute.;['0', '0', '3', '0', '0']
456;1.0;pro;The right to life is fundamental because it is crucial in order to allow people to access their other rights and make any future choices.;['0', '0', '0', '1', '0']
457;1.0;pro;The right to life is enshrined in Article 3 of the Universal Declaration of Human Rights.;['0', '0', '1', '0', '0']
458;1.0;con;The fact that the right to life is enshrined in the Universal Declaration of Human Rights (UDHR) doesn't make the right to life absolute. The UDHR says nothing about the right to life of animals or (hypothetical) aliens. The first article makes it clear that such rights begin at birth (p. 120).;['1', '0', '2', '0', '2']
459;1.0;con;The Universal Declaration of Human Rights is not a legally binding instrument.;['1', '0', '1', '2', '0']
460;1.0;con;The legal ramifications of a document have no bearing on the moral applicability of its implications.;['0', '0', '2', '0', '1']
461;1.0;con;Governments do not do everything they can to ensure that people remain alive for as long as possible, which they should if the right to life is absolute and fundamental.;['0', '0', '1', '0', '0']
462;1.0;pro;Governments do not put all of their money into healthcare and medical research to allow people to live as long as possible.;['1', '0', '2', '0', '1']
463;1.0;pro;Governments do not make it a requirement of people to donate organs even though this would mean being able to save many people's lives.;['1', '0', '2', '0', '1']
464;1.0;con;Governments do not do many other things that are good for the population. What governments do or fail to do shouldn't be used as an argument for the morality of anything.;['0', '1', '1', '0', '2']
465;1.0;con;The 'right to life' is not the same as 'the right to be kept alive for as long as possible'. It only means that a human has the right to live, and should not be killed by another human being.;['0', '1', '2', '0', '1']
466;1.0;con;The government made murder illegal because it violates the right to life. The same should go for abortion.;['0', '2', '1', '0', '1']
467;1.0;con;Capital punishment is still legal in a number of countries, and in a number of US states. This shows that at times the state condones the ending of life, meaning the right is not absolute.;['0', '0', '1', '0', '0']
468;1.0;con;Capital punishment is a specific circumstance where people have committed a heinous crime and therefore have a number of their rights restricted or taken away.;['0', '0', '1', '0', '1']
469;1.0;con;The removal of rights after due process is never the case with abortion. The gestating human has either done nothing to warrant the removal of their rights, or does not even possess such rights. Capital punishment has no bearing on the abortion discussion.;['1', '0', '2', '0', '2']
470;1.0;pro;Capital punishment is a penalty meant for someone who committed serious crimes. The fetus' life should not be terminated since he/she did not commit any crime.;['1', '0', '1', '1', '1']
471;1.0;con;Capital punishment is an act of self-defense, imparted only by the State, and is an act of last resort, i.e. the prisoner is still a danger to society. It is not a statement on the value or right to life of the one being executed.;['0', '2', '1', '0', '1']
472;1.0;pro;Capital punishment protects the right to life by establishing consequences for murderers.;['0', '1', '1', '0', '1']
473;1.0;pro;Even though a fetus cannot necessarily exist outside a mother's body immediately, it is a living being with the potential to live a full life and therefore should be protected.;['17', '5', '5', '10', '17']
474;1.0;pro;Allowing abortions means allowing people to end potential lives, removing all future possibilities of this being existing and having their own desires and wants.;['5', '1', '1', '1', '1']
475;1.0;pro;Abortion takes away any future experiences from a baby that was meant to be born.;['1', '0', '2', '0', '1']
476;1.0;con;The idea that someone is 'meant to do something' or that something is 'meant to happen' is an appeal to an unsubstantiated authority, and thus in effect is really just an attempt to impose the will of one person onto another.;['1', '0', '2', '0', '0']
477;1.0;con;"The suggestion that a baby was ""meant to be born"" relies on a belief in a higher power which has specific intentions. It is not clear that this is the case.";['1', '1', '1', '0', '4']
478;1.0;con;Abortions have the same ethical ramifications as abstinence and contraception - all three result in the lack of a life that could have existed. If abortion is unethical, so is avoiding impregnating and avoiding being impregnated at any time.;['0', '0', '1', '0', '0']
479;1.0;pro;If we draw the line at conception, then all hormone-based contraceptive methods are abortions.;['1', '0', '2', '0', '0']
480;1.0;pro;Hormone-based contraceptive methods can thicken the lining of the uterus, preventing attachment of the fertilized egg.;['0', '1', '1', '1', '1']
481;1.0;pro;If life truly were to begin at conception, IVF would also be highly immoral as multiple eggs are fertilized in vitro, and often not all of them used.;['0', '1', '1', '0', '2']
482;1.0;pro;IVF could be considered even more immoral, since whole teams of people spend lots of time effort and money deliberately pursuing treatments that end up leaving multiple embryos to die in the freezer.;['0', '0', '2', '0', '1']
483;1.0;con;Some pro-lifers such as Catholics oppose both abortion and IVF, so it is unlikely that they can be convinced to abandon the pro-life position.;['0', '1', '0', '0', '0']
484;1.0;con;Not all hormonal contraceptives are abortive. Many prevent ovulation, which means an egg is never released to be fertilized.;['0', '1', '1', '1', '1']
485;1.0;con;One could plausibly hold that abortion and hormone-based contraceptions are both immoral, so this claim doesn't address the pro-life position completely.;['0', '0', '1', '0', '0']
486;1.0;con;One could reject abortion and accept hormonal contraception if they regard the intention of the woman as morally relevant.;['0', '0', '1', '0', '0']
487;1.0;pro;In the case of hormonal contraception, if a zygote does fail to implant this was not intended by the woman. Instead, she intended to prevent the meeting of sperm and egg to form the zygote in the first place. In abortion, however, the destruction of the baby is fully intended.;['0', '0', '1', '0', '0']
488;1.0;con;This is a fallacy of equivocation. In the event of an abortion, the life of the fetus has already begun, so there exists something to be destroyed.;['0', '2', '0', '0', '3']
489;1.0;con;Given that abstinence and contraception are merely inaction resulting in a lack of life, whereas abortion is an intentional action which leads the destruction of life, the latter is moral by comparison.;['1', '0', '2', '0', '2']
490;1.0;con;Contraception is not inaction, as it requires very specific actions to be taken.;['1', '0', '1', '1', '2']
491;1.0;con;The action/inaction distinction is a matter of ease - it is hard to sacrifice your hard-earned money even when you know it's the right thing to do, but easy not to go out and rob a charity. An abortion and a healthy pregnancy both require effort and active intent.;['1', '1', '1', '0', '1']
492;1.0;con;Neither abortion advocates nor pro-life advocates claim that there is an ethical mandate to bring all theoretically possible life into the world, so this interpretation of the ethical ramifications is an example of an appeal to extremes fallacy.;['0', '1', '1', '0', '2']
